[{"id":"news-ingestion","label":"결정론적 이슈 cluster builder와 snapshot 입력","observed_at":"2026-08-30T00:00:00Z","source_type":"code"},{"id":"news-narrative","label":"캐시 rollback과 과거 검증 경계를 정리한 private narrative","observed_at":"2026-08-30T00:00:00Z","source_type":"project_memory"},{"id":"news-runtime","label":"서버 시작 scheduler 진입점","observed_at":"2026-08-30T00:00:00Z","source_type":"code"},{"id":"news-schema","label":"이슈 node와 관계 근거 schema","observed_at":"2026-08-30T00:00:00Z","source_type":"code"},{"id":"news-spec","label":"3분 이해와 운영 검수 제품 설계","observed_at":"2026-08-30T00:00:00Z","source_type":"spec"},{"id":"news-tests","label":"snapshot 원자 교체와 fallback 테스트","observed_at":"2026-08-30T00:00:00Z","source_type":"test"},{"id":"news-ui","label":"오늘 화면의 모바일 진입 구조","observed_at":"2026-08-30T00:00:00Z","source_type":"code"}]
