[{"id":"operation-worklog-null","label":"사용자 식별 결측을 0이 아닌 공란으로 정정한 기록","observed_at":"2026-08-31T00:00:00Z","source_type":"test"},{"id":"operation-pipeline-session","label":"세션별 모드와 검색 신호 판정 구현","observed_at":"2026-08-31T00:00:00Z","source_type":"code"},{"id":"operation-business","label":"FIFO 질문 응답 pairing과 실패 분석","observed_at":"2026-08-31T00:00:00Z","source_type":"code"},{"id":"operation-pipeline-order","label":"SQLite 적재와 오름차순 세션 처리 구현","observed_at":"2026-08-31T00:00:00Z","source_type":"code"},{"id":"operation-worklog-encoding","label":"재업로드 입력의 UTF-8 무결성 확인","observed_at":"2026-08-31T00:00:00Z","source_type":"test"},{"id":"operation-worklog-scale","label":"병합 중복 제거와 세션 처리 규모","observed_at":"2026-08-31T00:00:00Z","source_type":"test"},{"id":"operation-report","label":"질문 응답 실패 집계와 해석","observed_at":"2026-08-31T00:00:00Z","source_type":"test"}]
