[{"id":"map-diary-readme","label":"원본 도로 Feature 기반 MVP 범위","observed_at":"2026-08-30T00:00:00Z","source_type":"project_memory"},{"id":"map-diary-decisions","label":"데이터와 화면 상태 결정 기록","observed_at":"2026-08-30T00:00:00Z","source_type":"spec"},{"id":"map-diary-data-source","label":"VWorld WFS 레이어와 fail-closed 데이터 경계","observed_at":"2026-08-30T00:00:00Z","source_type":"spec"},{"id":"map-diary-domain","label":"snapshot record와 endpoint graph 구현","observed_at":"2026-08-30T00:00:00Z","source_type":"code"},{"id":"map-diary-app","label":"검색 선택 저장 복원 애플리케이션 흐름","observed_at":"2026-08-30T00:00:00Z","source_type":"code"},{"id":"map-diary-domain-tests","label":"저장 복원과 도로 연결 회귀 계약","observed_at":"2026-08-30T00:00:00Z","source_type":"test"},{"id":"map-diary-narrative","label":"프로젝트 문제와 구현 결과 요약","observed_at":"2026-08-30T00:00:00Z","source_type":"project_memory"}]
