[{"id":"memento-readme","label":"공개 코드와 비공개 runtime data 운영 정책","observed_at":"2026-08-31T00:00:00Z","source_type":"project_memory"},{"id":"memento-server","label":"volume 저장소와 인증 scope 구현","observed_at":"2026-08-31T00:00:00Z","source_type":"code"},{"id":"memento-cookie","label":"HttpOnly Secure SameSite cookie 설정","observed_at":"2026-08-31T00:00:00Z","source_type":"code"},{"id":"memento-sanitize","label":"잠긴 entry 응답의 본문과 요약 제거","observed_at":"2026-08-31T00:00:00Z","source_type":"code"},{"id":"memento-data-block","label":"정적 data 경로 차단","observed_at":"2026-08-31T00:00:00Z","source_type":"code"},{"id":"memento-app","label":"비공개 목록 preview 고정 문구","observed_at":"2026-08-31T00:00:00Z","source_type":"code"},{"id":"memento-edit-delete","label":"비공개 unlock 후 수정과 삭제 흐름","observed_at":"2026-08-31T00:00:00Z","source_type":"code"},{"id":"memento-ignore","label":"runtime data ignore 정책","observed_at":"2026-08-31T00:00:00Z","source_type":"git"},{"id":"memento-tracked-private","label":"공개 범위 주장과 충돌하는 추적 자산","observed_at":"2026-08-31T00:00:00Z","source_type":"git"}]
