[{"id":"hub-source-separation","label":"registry와 memory profile 정본 분리","observed_at":"2026-08-31T00:00:00Z","source_type":"spec"},{"id":"hub-adapter-model","label":"normalized profile에서 생성하는 tool adapters","observed_at":"2026-08-31T00:00:00Z","source_type":"code"},{"id":"hub-v1-scope","label":"workflow builder보다 운영 안정성을 우선한 V1","observed_at":"2026-08-31T00:00:00Z","source_type":"spec"},{"id":"hub-auth-revision","label":"파일 session에서 signed cookie로 변경","observed_at":"2026-08-31T00:00:00Z","source_type":"code"},{"id":"hub-access-provider","label":"사용량과 plan 분리 및 provider 오류 정제","observed_at":"2026-08-31T00:00:00Z","source_type":"code"},{"id":"hub-stale-registry","label":"2026년 3월 registry와 23개 미설정 update status","observed_at":"2026-08-31T00:00:00Z","source_type":"spec"},{"id":"hub-updater-limit","label":"부분 updater와 manual review 상태","observed_at":"2026-08-31T00:00:00Z","source_type":"code"},{"id":"hub-memory-boundary","label":"프로젝트 내부 memory와 현재 전역 memory 경계","observed_at":"2026-08-31T00:00:00Z","source_type":"spec"}]
