[{"id":"normal-route-source","label":"route_turn과 판정 출처 계약","observed_at":"2026-08-31T00:00:00Z","source_type":"code"},{"id":"normal-planner-range","label":"8,720행 5-fold planner 결과 범위","observed_at":"2026-08-31T00:00:00Z","source_type":"test"},{"id":"normal-planner-target","label":"85/80 목표와 planner below-gate","observed_at":"2026-08-31T00:00:00Z","source_type":"test"},{"id":"normal-dqr-main","label":"579질의 Location과 Source retrieval","observed_at":"2026-08-31T00:00:00Z","source_type":"test"},{"id":"normal-dqr-subsets","label":"holdout, OCR subset과 p95","observed_at":"2026-08-31T00:00:00Z","source_type":"test"},{"id":"normal-runtime-boundary","label":"노출된 holdout과 runtime 미연결","observed_at":"2026-08-31T00:00:00Z","source_type":"spec"},{"id":"normal-retrieval-stack","label":"lexical, dense, local rerank와 conditional fusion","observed_at":"2026-08-31T00:00:00Z","source_type":"test"},{"id":"normal-layout-rollback","label":"layout-aware retrieval 회귀와 default-off","observed_at":"2026-08-31T00:00:00Z","source_type":"test"},{"id":"normal-planner-mid","label":"prompt-only 비교 후보 57.36%","observed_at":"2026-08-31T00:00:00Z","source_type":"test"},{"id":"normal-dqr-s025","label":"S-025의 높은 hit와 실패한 정보조회 및 p95 gate","observed_at":"2026-08-31T00:00:00Z","source_type":"test"}]
