[{"id":"feeling-memory","label":"알림, 인사이트와 안전 backlog 결정","observed_at":"2026-08-30T00:00:00Z","source_type":"project_memory"},{"id":"feeling-narrative","label":"mapped revision과 현재 검증 경계를 정리한 private narrative","observed_at":"2026-08-30T00:00:00Z","source_type":"project_memory"},{"id":"feeling-server","label":"공통 SQLite API와 대화 fallback 구현","observed_at":"2026-08-30T00:00:00Z","source_type":"code"},{"id":"feeling-web","label":"웹 기록 관리와 통계 클라이언트","observed_at":"2026-08-30T00:00:00Z","source_type":"code"},{"id":"feeling-widget","label":"위젯 클릭, 위치 보정과 단일 팝업 구현","observed_at":"2026-08-30T00:00:00Z","source_type":"code"}]
