[{"id":"v3-native-design","label":"Capacitor web-native 경계와 SQLite 원본 설계","observed_at":"2026-08-30T00:00:00Z","source_type":"spec"},{"id":"v3-native-store","label":"SQLite WAL transaction과 sequence paging 구현","observed_at":"2026-08-30T00:00:00Z","source_type":"code"},{"id":"v3-native-client","label":"Capacitor bridge와 afterSequence client 계약","observed_at":"2026-08-30T00:00:00Z","source_type":"code"},{"id":"v3-v4-native-store","label":"saved 24시간과 review 30일 cleanup 및 CAS 저장 구현","observed_at":"2026-08-30T00:00:00Z","source_type":"code"},{"id":"v3-v4-native-client","label":"VWorld ITS whitelist와 revision conflict client 계약","observed_at":"2026-08-30T00:00:00Z","source_type":"code"},{"id":"v3-review-analysis","label":"provider completeness와 needsManualJoin 분류 구현","observed_at":"2026-08-30T00:00:00Z","source_type":"code"},{"id":"v3-manual-resolution-design","label":"기존 matching과 후보 분류기를 재사용한 수동 도로 연결 설계","observed_at":"2026-08-30T00:00:00Z","source_type":"spec"},{"id":"v3-release-report","label":"manual resolution 로컬 검증과 미실행 release gate","observed_at":"2026-08-30T00:00:00Z","source_type":"test"},{"id":"v3-auto-drive-design","label":"opt-in 저전력 자동 감지와 review-only 설계","observed_at":"2026-08-30T00:00:00Z","source_type":"spec"},{"id":"v3-auto-drive-device-gate","label":"iPhone 자동 감지와 배터리 release gate","observed_at":"2026-08-30T00:00:00Z","source_type":"test"}]
