[{"id":"v2-gps-design","label":"TMAP 24시간 제약과 VWorld 영구 snapshot 설계","observed_at":"2026-08-30T00:00:00Z","source_type":"spec"},{"id":"v2-static-preview-design","label":"static preview와 기존 저장 경계 설계","observed_at":"2026-08-30T00:00:00Z","source_type":"spec"},{"id":"v2-static-preview-plan","label":"GPS 제외와 static route preview 구현 범위","observed_at":"2026-08-30T00:00:00Z","source_type":"spec"},{"id":"v2-server-proxy","label":"TMAP과 VWorld 서버 프록시 및 응답 정규화","observed_at":"2026-08-30T00:00:00Z","source_type":"code"},{"id":"v2-tmap-workflow","label":"route 요청과 guidance point workflow","observed_at":"2026-08-30T00:00:00Z","source_type":"code"},{"id":"v2-domain-storage","label":"route group snapshot과 displayGeometry 저장 구현","observed_at":"2026-08-30T00:00:00Z","source_type":"code"},{"id":"v2-app-persistence","label":"TMAP 파생 route record의 localStorage 보존 경로","observed_at":"2026-08-30T00:00:00Z","source_type":"code"},{"id":"v2-domain-tests","label":"route group displayGeometry와 spot 저장 회귀 계약","observed_at":"2026-08-30T00:00:00Z","source_type":"test"},{"id":"v2-workflow-tests","label":"TMAP spot route와 guidance 회귀 테스트","observed_at":"2026-08-30T00:00:00Z","source_type":"test"},{"id":"v2-server-tests","label":"provider 정규화와 guidance point 서버 테스트","observed_at":"2026-08-30T00:00:00Z","source_type":"test"}]
