[{"id":"word-app","label":"review-first selector, stage와 local merge client","observed_at":"2026-08-30T00:00:00Z","source_type":"code"},{"id":"word-data","label":"현재 N1 단어 데이터 범위의 한 표면","observed_at":"2026-08-30T00:00:00Z","source_type":"code"},{"id":"word-narrative","label":"복습 priority 변경과 과거 실행 경계를 정리한 private narrative","observed_at":"2026-08-30T00:00:00Z","source_type":"project_memory"},{"id":"word-server","label":"계정 JSON과 임베딩 의미 판정 API","observed_at":"2026-08-30T00:00:00Z","source_type":"code"}]
