[{"id":"book-readme","label":"비개발 PM 학습 목표와 10권 구성","observed_at":"2026-08-31T00:00:00Z","source_type":"project_memory"},{"id":"book-observation-action","label":"명령 전송과 실제 기기 실행을 구분하는 교훈","observed_at":"2026-08-31T00:00:00Z","source_type":"spec"},{"id":"book-roadmap","label":"서비스 경계를 따른 10권 roadmap","observed_at":"2026-08-31T00:00:00Z","source_type":"spec"},{"id":"book-production","label":"목표 분량과 현재 미완성 경계","observed_at":"2026-08-31T00:00:00Z","source_type":"spec"},{"id":"book-pages","label":"Markdown 기반 정적 HTML 생성기","observed_at":"2026-08-31T00:00:00Z","source_type":"code"},{"id":"book-search-index","label":"고정 page 목록 기반 검색 index 생성","observed_at":"2026-08-31T00:00:00Z","source_type":"code"},{"id":"book-search-ui","label":"glossary와 본문 검색 점수 계산","observed_at":"2026-08-31T00:00:00Z","source_type":"code"},{"id":"book-case","label":"사례 익명화와 관찰 후보 분리","observed_at":"2026-08-31T00:00:00Z","source_type":"spec"}]
