[{"id":"account-desktop","label":"Electron single instance, 1회 이관과 local fallback","observed_at":"2026-08-30T00:00:00Z","source_type":"code"},{"id":"account-narrative","label":"mapped UX revision과 패키징 경계를 정리한 private narrative","observed_at":"2026-08-30T00:00:00Z","source_type":"project_memory"},{"id":"account-server","label":"단일 JSON API와 원자 교체 구현","observed_at":"2026-08-30T00:00:00Z","source_type":"code"},{"id":"account-web","label":"연간 표, dropdown과 sticky 상태 구현","observed_at":"2026-08-30T00:00:00Z","source_type":"code"}]
