[{"id":"tmap-clone-readme","label":"현재 React 웹 내비게이션 범위와 변경 기록","observed_at":"2026-08-30T00:00:00Z","source_type":"spec"},{"id":"tmap-clone-package","label":"React Vite Express PWA 기술 구성","observed_at":"2026-08-30T00:00:00Z","source_type":"code"},{"id":"tmap-clone-handover","label":"설명 가능한 장거리 주행 제품 목표","observed_at":"2026-08-30T00:00:00Z","source_type":"project_memory"},{"id":"tmap-clone-narrative","label":"카메라 API 경계와 제품 롤백 서사","observed_at":"2026-08-30T00:00:00Z","source_type":"project_memory"},{"id":"tmap-clone-road-master-prd","label":"Road Master 도로 선택과 traversal 제품 계약","observed_at":"2026-08-30T00:00:00Z","source_type":"spec"},{"id":"tmap-clone-store","label":"raw GPS matched 위치 actual drive와 Road Master 상태 구현","observed_at":"2026-08-30T00:00:00Z","source_type":"code"},{"id":"tmap-clone-navigation-logic","label":"route projection heading과 deterministic replay 구현","observed_at":"2026-08-30T00:00:00Z","source_type":"code"},{"id":"tmap-clone-map-view","label":"MapLibre heading-up camera와 실제 위치 우선 구현","observed_at":"2026-08-30T00:00:00Z","source_type":"code"},{"id":"tmap-clone-known-limits","label":"경관 waypoint와 웹 위치 추종 한계 기록","observed_at":"2026-08-30T00:00:00Z","source_type":"spec"},{"id":"tmap-clone-qa-gate","label":"실제 제한속도 차선과 heading QA 판정","observed_at":"2026-08-30T00:00:00Z","source_type":"test"},{"id":"tmap-clone-harness","label":"카메라 simulation trusted data와 traversal 회귀 harness","observed_at":"2026-08-30T00:00:00Z","source_type":"test"},{"id":"tmap-clone-server","label":"Express 외부 API proxy와 fallback 구현","observed_at":"2026-08-30T00:00:00Z","source_type":"code"}]
