[{"id":"dictionary-readme","label":"전환 자산의 독립 소유 범위","observed_at":"2026-08-31T00:00:00Z","source_type":"project_memory"},{"id":"dictionary-release-gate","label":"holdout 통과 후 배포하는 release gate","observed_at":"2026-08-31T00:00:00Z","source_type":"spec"},{"id":"dictionary-policy","label":"네 종류 사전과 등록 및 충돌 정책","observed_at":"2026-08-31T00:00:00Z","source_type":"spec"},{"id":"dictionary-guide","label":"룰베이스 대체 판단과 홀드아웃 기준","observed_at":"2026-08-31T00:00:00Z","source_type":"spec"},{"id":"dictionary-q1","label":"Q1 corrected quick 검증 결과","observed_at":"2026-08-31T00:00:00Z","source_type":"test"},{"id":"dictionary-march","label":"3월 corrected 홀드아웃 결과","observed_at":"2026-08-31T00:00:00Z","source_type":"test"},{"id":"dictionary-novdec","label":"11월과 12월 raw corrected 비교","observed_at":"2026-08-31T00:00:00Z","source_type":"test"},{"id":"dictionary-moe-shadow","label":"별도 MoE shadow 라우팅 결과","observed_at":"2026-08-31T00:00:00Z","source_type":"test"}]
