[{"id":"v6-baseline-clone","label":"v5 현재 작업 트리 복제와 v6 전용 release 브랜치 분리","observed_at":"2026-09-24T00:00:00+09:00","source_type":"git"},{"id":"v6-login-settings-permissions-design","label":"선택 로그인과 로컬 우선 Supabase 동기화 및 권한 허브 승인 설계","observed_at":"2026-09-24T00:00:00+09:00","source_type":"spec"},{"id":"v6-login-settings-permissions-implementation","label":"로그인 설정 권한과 계정별 로컬 우선 동기화 구현 및 로컬 검증","observed_at":"2026-09-25T00:00:00+09:00","source_type":"test"},{"id":"v6-web-native-runtime-fix","label":"웹 Capacitor 오인으로 발생한 Playwright 연쇄 실패와 플랫폼 판별 수정","observed_at":"2026-09-26T00:00:00+09:00","source_type":"test"},{"id":"v6-web-contract-recovery","label":"v6 설정 허브 이후 홈 주행 계약과 Leaflet 계측 및 IndexedDB 회귀 복구","observed_at":"2026-09-26T00:00:00+09:00","source_type":"test"},{"id":"v6-final-web-regression-fix","label":"남은 웹 회귀 3건의 설정 화면 높이 동기화와 영역 상태 계약 교정","observed_at":"2026-09-26T00:00:00+09:00","source_type":"test"},{"id":"v5-ink-journal-design","label":"자동 주행 중심 개편의 승인 설계","observed_at":"2026-09-09T05:25:21Z","source_type":"spec"},{"id":"v5-app-integration","label":"단일 지도와 전체 화면 및 저장 복구와 가장자리 뒤로가기 연결","observed_at":"2026-09-21T17:34:34+09:00","source_type":"code"},{"id":"v5-manual-code","label":"수동 추가 요청 수명과 날짜 및 선택 검증","observed_at":"2026-09-09T05:25:21Z","source_type":"code"},{"id":"v5-territory-code","label":"고정 기준 셀과 저장 기록 통계","observed_at":"2026-09-09T05:25:21Z","source_type":"code"},{"id":"v5-runtime-code","label":"저장 및 실제 주행 계산 작업과 영수증 스냅샷","observed_at":"2026-09-09T05:25:21Z","source_type":"code"},{"id":"v5-records-code","label":"통합 기록과 저장 영수증 및 검토 초안 서명","observed_at":"2026-09-09T05:25:21Z","source_type":"code"},{"id":"v5-current-qa","label":"현행 구현 검증과 미실행 및 배포 경계","observed_at":"2026-09-11T15:06:59+09:00","source_type":"test"},{"id":"v5-codemagic-config","label":"CI와 TestFlight가 분리된 기존 배포 구성","observed_at":"2026-09-09T05:25:21Z","source_type":"code"},{"id":"v5-automatic-visit-count","label":"기존 도로 칸 재방문 자동 카운트와 상세 증감 UI 제거","observed_at":"2026-09-09T06:21:38Z","source_type":"code"},{"id":"v5-ui-polish-layout","label":"단일 서체와 공통 화면 간격 및 iPhone 안전영역과 종료 확인 표시 계층","observed_at":"2026-09-13T21:55:58+09:00","source_type":"code"},{"id":"v5-v38-pencil-design","label":"v38 캡처 기반 화면 정렬과 타이포 및 버튼 위계 개선 시안","observed_at":"2026-09-10T14:57:40+09:00","source_type":"spec"},{"id":"v1-v5-git-history","label":"v1부터 v5까지의 저장소와 브랜치별 기능 진화 이력","observed_at":"2026-09-11T11:00:00+09:00","source_type":"git"},{"id":"v5-iphone-safe-area-e2e","label":"iPhone 16 Pro 안전영역 12화면과 가장자리 뒤로가기 브라우저 회귀","observed_at":"2026-09-21T15:30:00+09:00","source_type":"test"},{"id":"v5-viewport-resize-e2e","label":"지연 이벤트와 layout viewport 고정 상태의 VisualViewport 축소 회귀","observed_at":"2026-09-21T15:30:00+09:00","source_type":"test"},{"id":"v5-responsive-design","label":"Compact Medium Expanded 반응형 지도 일기 승인 설계","observed_at":"2026-09-13T01:00:00+09:00","source_type":"spec"},{"id":"v5-responsive-layout-code","label":"반응형 화면 구조와 VisualViewport 및 지도 수명 보완","observed_at":"2026-09-13T21:55:58+09:00","source_type":"code"},{"id":"v5-responsive-e2e","label":"19개 viewport 브라우저 반응형 매트릭스","observed_at":"2026-09-21T15:30:00+09:00","source_type":"test"},{"id":"v5-responsive-screen-e2e","label":"11개 화면과 권한 및 종료 dialog 브라우저 흐름","observed_at":"2026-09-21T15:30:00+09:00","source_type":"test"},{"id":"v5-responsive-qa","label":"현재 반응형 로컬 검증 결과와 실기기 및 원격 미실행 경계","observed_at":"2026-09-14T09:53:56+09:00","source_type":"test"},{"id":"v5-responsive-captures","label":"휴대폰 세로 가로 태블릿 세로 가로 웹 대표 화면 직접 검토 캡처","observed_at":"2026-09-14T09:53:56+09:00","source_type":"test"},{"id":"v5-gps-auto-save","label":"GPS 자동저장과 기록함 손상 보호 수정 및 전체 209개 회귀 통과","observed_at":"2026-09-21T14:43:00+09:00","source_type":"test"},{"id":"v5-home-map-expand","label":"홈 정보 패널 내리기와 단일 지도 유지 및 반응형 브라우저 검증","observed_at":"2026-09-21T15:30:00+09:00","source_type":"test"},{"id":"v5-v43-storage-code","label":"용량 초과 때 전체 기록함을 IndexedDB로 옮기는 저장 구현","observed_at":"2026-09-21T17:34:34+09:00","source_type":"code"},{"id":"v5-v43-route-code","label":"거부 GPS 제외와 보정 좌표 재그리기 판정","observed_at":"2026-09-21T17:34:34+09:00","source_type":"code"},{"id":"v5-v43-qa","label":"V43 저장 실패와 지도 가독성 변경의 로컬 검증 경계","observed_at":"2026-09-21T17:34:34+09:00","source_type":"test"}]
