[{"id":"lambda-entry-flag","label":"약관 gate와 feature flag 분기","observed_at":"2026-08-31T00:00:00Z","source_type":"code"},{"id":"lambda-rollback","label":"기존 full_rag로 돌아가는 rollback 경로","observed_at":"2026-08-31T00:00:00Z","source_type":"code"},{"id":"lambda-depth","label":"true planner re-entry와 cycle/depth guard 미구현","observed_at":"2026-08-31T00:00:00Z","source_type":"spec"},{"id":"lambda-agent-boundaries","label":"family agent와 backend 소유권 경계","observed_at":"2026-08-31T00:00:00Z","source_type":"spec"},{"id":"lambda-proactive","label":"reactive와 proactive 계약 분리","observed_at":"2026-08-31T00:00:00Z","source_type":"code"},{"id":"lambda-context-measure","label":"compact context 과거 측정과 정확도 미측정","observed_at":"2026-08-31T00:00:00Z","source_type":"code"},{"id":"lambda-mock-boundary","label":"mock 검증과 live backend 미검증","observed_at":"2026-08-31T00:00:00Z","source_type":"test"},{"id":"lambda-depth-value","label":"family agent 호출에 depth 2 전달","observed_at":"2026-08-31T00:00:00Z","source_type":"code"}]
