[{"id":"moe-routing-stack","label":"계층형 routing stack","observed_at":"2026-08-31T00:00:00Z","source_type":"spec"},{"id":"moe-small-eval","label":"593행 prompt-only와 normalization 결과","observed_at":"2026-08-31T00:00:00Z","source_type":"test"},{"id":"moe-ops-sample","label":"1,500행 운영 표본 prompt-only 결과","observed_at":"2026-08-31T00:00:00Z","source_type":"test"},{"id":"moe-owner-below-gate","label":"Stage 2 owner 선택 26/100 below-gate","observed_at":"2026-08-31T00:00:00Z","source_type":"test"},{"id":"moe-contract-eval","label":"Stage 2 결과 계약 400행 평가","observed_at":"2026-08-31T00:00:00Z","source_type":"test"},{"id":"moe-selector-boundary","label":"저신뢰 후보에만 적용하는 selector","observed_at":"2026-08-31T00:00:00Z","source_type":"spec"},{"id":"moe-empty-cv","label":"0행 full CV summary","observed_at":"2026-08-31T00:00:00Z","source_type":"test"},{"id":"moe-small-prompt-only","label":"593행 prompt-only 결과","observed_at":"2026-08-31T00:00:00Z","source_type":"test"}]
