[{"id":"piano-app","label":"key map, sample audio와 practice 상태 구현","observed_at":"2026-08-30T00:00:00Z","source_type":"code"},{"id":"piano-docs","label":"초기 정적 Web Audio 범위와 구식 key map 문서","observed_at":"2026-08-30T00:00:00Z","source_type":"spec"},{"id":"piano-memory","label":"oscillator에서 sample로 전환한 결정","observed_at":"2026-08-30T00:00:00Z","source_type":"project_memory"},{"id":"piano-narrative","label":"현재 dirty 연습 기능과 검증 공백을 정리한 private narrative","observed_at":"2026-08-30T00:00:00Z","source_type":"project_memory"},{"id":"piano-ui","label":"건반, mode와 practice 화면 구조","observed_at":"2026-08-30T00:00:00Z","source_type":"code"}]
