[{"id":"todack-memory","label":"제품 확장, 저장소와 통계 결정","observed_at":"2026-08-30T00:00:00Z","source_type":"project_memory"},{"id":"todack-mobile","label":"Expo 세션, 음성, 알림과 공통 API client","observed_at":"2026-08-30T00:00:00Z","source_type":"code"},{"id":"todack-narrative","label":"mapped product revision과 검증 경계를 정리한 private narrative","observed_at":"2026-08-30T00:00:00Z","source_type":"project_memory"},{"id":"todack-prompts","label":"코드 밖 런타임 대화 프롬프트","observed_at":"2026-08-30T00:00:00Z","source_type":"spec"},{"id":"todack-server","label":"인증, 사용자 SQLite, 프로필, 캡슐과 미션 API","observed_at":"2026-08-30T00:00:00Z","source_type":"code"},{"id":"todack-stats","label":"180 fixture 자기 일관성 판정 도구","observed_at":"2026-08-30T00:00:00Z","source_type":"test"},{"id":"todack-web","label":"웹 기록, 채팅과 리디자인 client","observed_at":"2026-08-30T00:00:00Z","source_type":"code"}]
