[{"id":"office-intake-approval","label":"단일 intake와 승인 전 dispatch 금지","observed_at":"2026-08-31T00:00:00Z","source_type":"test"},{"id":"office-handoff-mode","label":"report-only와 implementation-required 구분","observed_at":"2026-08-31T00:00:00Z","source_type":"test"},{"id":"office-runtime-preflight","label":"runtime preflight와 blocked 처리","observed_at":"2026-08-31T00:00:00Z","source_type":"test"},{"id":"office-path-proof","label":"요청 경로 실재 검사","observed_at":"2026-08-31T00:00:00Z","source_type":"test"},{"id":"office-checkout-gate","label":"미완료 업무의 day completion 차단","observed_at":"2026-08-31T00:00:00Z","source_type":"test"},{"id":"office-timeout-owner","label":"timeout 이후 사람의 정리 소유권","observed_at":"2026-08-31T00:00:00Z","source_type":"test"},{"id":"office-historical-tests","label":"19개 테스트 선언과 과거 19/19 실행","observed_at":"2026-08-31T00:00:00Z","source_type":"test"},{"id":"office-fake-integrations","label":"fake 외부 연동과 live 미검증","observed_at":"2026-08-31T00:00:00Z","source_type":"test"},{"id":"office-pipeline-tests","label":"pipeline 테스트 선언","observed_at":"2026-08-31T00:00:00Z","source_type":"test"},{"id":"office-rendered-tests","label":"rendered 및 integration 테스트 선언","observed_at":"2026-08-31T00:00:00Z","source_type":"test"}]
