[{"id":"wine-docs","label":"개인 시음 장부 v1 범위","observed_at":"2026-08-30T00:00:00Z","source_type":"spec"},{"id":"wine-narrative","label":"7회 3종 표시 수정과 보존 결정을 정리한 private narrative","observed_at":"2026-08-30T00:00:00Z","source_type":"project_memory"},{"id":"wine-server","label":"OCR 후보와 JSON 기록 API","observed_at":"2026-08-30T00:00:00Z","source_type":"code"},{"id":"wine-test","label":"과거 API harness 결과를 요약한 private narrative","observed_at":"2026-08-30T00:00:00Z","source_type":"project_memory"},{"id":"wine-web","label":"wine ID grouping, Times와 pagination 구현","observed_at":"2026-08-30T00:00:00Z","source_type":"code"}]
