[{"id":"polite-backend","label":"OAuth, 재작성, 사용량과 문의 backend","observed_at":"2026-08-30T00:00:00Z","source_type":"code"},{"id":"polite-docs","label":"현재 가격 문서와 runtime policy 충돌 표면","observed_at":"2026-08-30T00:00:00Z","source_type":"spec"},{"id":"polite-narrative","label":"제출 패키지 rollback과 현재 검증 경계를 정리한 private narrative","observed_at":"2026-08-30T00:00:00Z","source_type":"project_memory"},{"id":"polite-popup","label":"MV3 popup의 OAuth session과 재작성 UX","observed_at":"2026-08-30T00:00:00Z","source_type":"code"},{"id":"polite-release","label":"제출 host permission과 packaged extension metadata","observed_at":"2026-08-30T00:00:00Z","source_type":"code"}]
