[{"id":"gemini-three-surfaces","label":"REPL, JSON과 XLSX 실행 표면","observed_at":"2026-08-31T00:00:00Z","source_type":"spec"},{"id":"gemini-session-state","label":"history와 persona transition 상태","observed_at":"2026-08-31T00:00:00Z","source_type":"code"},{"id":"gemini-schema-fallback","label":"provider 호환 schema와 no-schema 옵션","observed_at":"2026-08-31T00:00:00Z","source_type":"spec"},{"id":"gemini-json-recovery","label":"best-effort JSON 복구와 raw 보존","observed_at":"2026-08-31T00:00:00Z","source_type":"code"},{"id":"gemini-retry-policy","label":"네트워크 오류만 재시도하는 정책","observed_at":"2026-08-31T00:00:00Z","source_type":"code"},{"id":"gemini-row-reset","label":"XLSX 행별 session reset","observed_at":"2026-08-31T00:00:00Z","source_type":"code"},{"id":"gemini-no-quality-score","label":"XLSX runner의 응답 파싱과 전체 호출 로그","observed_at":"2026-08-31T00:00:00Z","source_type":"code"}]
