[{"id":"v5-ink-journal-design","label":"자동 주행 중심 개편의 승인 설계","observed_at":"2026-09-09T05:25:21Z","source_type":"spec"},{"id":"v5-app-integration","label":"단일 지도와 전체 화면 및 저장 복구와 가장자리 뒤로가기 연결","observed_at":"2026-09-11T13:56:57+09:00","source_type":"code"},{"id":"v5-manual-code","label":"수동 추가 요청 수명과 날짜 및 선택 검증","observed_at":"2026-09-09T05:25:21Z","source_type":"code"},{"id":"v5-territory-code","label":"고정 기준 셀과 저장 기록 통계","observed_at":"2026-09-09T05:25:21Z","source_type":"code"},{"id":"v5-runtime-code","label":"저장 및 실제 주행 계산 작업과 영수증 스냅샷","observed_at":"2026-09-09T05:25:21Z","source_type":"code"},{"id":"v5-records-code","label":"통합 기록과 저장 영수증 및 검토 초안 서명","observed_at":"2026-09-09T05:25:21Z","source_type":"code"},{"id":"v5-current-qa","label":"현행 구현 검증과 미실행 및 배포 경계","observed_at":"2026-09-11T15:06:59+09:00","source_type":"test"},{"id":"v5-codemagic-config","label":"CI와 TestFlight가 분리된 기존 배포 구성","observed_at":"2026-09-09T05:25:21Z","source_type":"code"},{"id":"v5-automatic-visit-count","label":"기존 도로 칸 재방문 자동 카운트와 상세 증감 UI 제거","observed_at":"2026-09-09T06:21:38Z","source_type":"code"},{"id":"v5-ui-polish-layout","label":"단일 서체와 공통 화면 간격 및 iPhone 안전영역과 종료 확인 표시 계층","observed_at":"2026-09-13T21:55:58+09:00","source_type":"code"},{"id":"v5-v38-pencil-design","label":"v38 캡처 기반 화면 정렬과 타이포 및 버튼 위계 개선 시안","observed_at":"2026-09-10T14:57:40+09:00","source_type":"spec"},{"id":"v1-v5-git-history","label":"v1부터 v5까지의 저장소와 브랜치별 기능 진화 이력","observed_at":"2026-09-11T11:00:00+09:00","source_type":"git"},{"id":"v5-iphone-safe-area-e2e","label":"iPhone 16 Pro 안전영역 12화면과 가장자리 뒤로가기 브라우저 회귀","observed_at":"2026-09-14T09:53:56+09:00","source_type":"test"},{"id":"v5-viewport-resize-e2e","label":"지연 이벤트와 layout viewport 고정 상태의 VisualViewport 축소 회귀","observed_at":"2026-09-14T09:53:56+09:00","source_type":"test"},{"id":"v5-responsive-design","label":"Compact Medium Expanded 반응형 지도 일기 승인 설계","observed_at":"2026-09-13T01:00:00+09:00","source_type":"spec"},{"id":"v5-responsive-layout-code","label":"반응형 화면 구조와 VisualViewport 및 지도 수명 보완","observed_at":"2026-09-13T21:55:58+09:00","source_type":"code"},{"id":"v5-responsive-e2e","label":"19개 viewport 브라우저 반응형 매트릭스","observed_at":"2026-09-14T09:53:56+09:00","source_type":"test"},{"id":"v5-responsive-screen-e2e","label":"11개 화면과 권한 및 종료 dialog 브라우저 흐름","observed_at":"2026-09-14T09:53:56+09:00","source_type":"test"},{"id":"v5-responsive-qa","label":"현재 반응형 로컬 검증 결과와 실기기 및 원격 미실행 경계","observed_at":"2026-09-14T09:53:56+09:00","source_type":"test"},{"id":"v5-responsive-captures","label":"휴대폰 세로 가로 태블릿 세로 가로 웹 대표 화면 직접 검토 캡처","observed_at":"2026-09-14T09:53:56+09:00","source_type":"test"}]
